event,category,probability,one_in_x,probability_type,interpretation,source_name,source_url,notes
A randomly selected day has a forest or landscape fire,Nature,1.0,1.0,daily_event_probability,About 1 in 1.0 days,Forest and landscape fires,https://andmed.eesti.ee/datasets/metsa-ja-maastikutulekahjud,Calculated from downloaded forest and landscape fire data. Observed period: 1970-01-01 to 1970-01-01. Days with at least one event: 1. Total observed days: 1. Total event records: 12243.
A randomly selected day has at least one traffic accident with injured people,Traffic,0.9946438411685077,1.01,daily_event_probability,About 1 in 1.01 days,Statistics Estonia TS093 traffic accidents data,https://andmed.stat.ee/et/stat/TS093,Calculated from Statistics Estonia TS093. Year: 2024. Annual traffic accidents with injured people: 1914. Daily probability estimated with a simple Poisson approximation.
A randomly selected forest stand has pine as dominant tree species,Nature,0.3,3.33,record_share,About 1 in 3 forest stands,Forest inventory / SMI,https://andmed.eesti.ee/datasets/smi-statistilise-metsainventeerimise-andmestik,Example value for first MVP plot
A randomly selected forest stand has birch as dominant tree species,Nature,0.3,3.33,record_share,About 1 in 3 forest stands,Forest inventory / SMI,https://andmed.eesti.ee/datasets/smi-statistilise-metsainventeerimise-andmestik,Example value for first MVP plot
A randomly selected 10-minute interval has at least one death in Estonia,Population,0.2580533435565885,3.88,interval_event_probability,About 1 in 3.9 ten-minute intervals,Statistics Estonia RV030 births/deaths data,https://andmed.stat.ee/et/stat/RV030,Calculated from Statistics Estonia RV030. Year: 2025. Annual deaths: 15688. Probability estimated with a simple Poisson approximation.
A randomly selected 10-minute interval has at least one birth in Estonia,Population,0.1612135102780714,6.2,interval_event_probability,About 1 in 6.2 ten-minute intervals,Statistics Estonia RV030 births/deaths data,https://andmed.stat.ee/et/stat/RV030,Calculated from Statistics Estonia RV030. Year: 2025. Annual births: 9240. Probability estimated with a simple Poisson approximation.
A randomly selected day has an EE-ALARM crisis alert,Crisis,0.01,100.0,daily_event_probability,About 1 in 100 days,EE-ALARM crisis alerts,https://andmed.eesti.ee/datasets/ulevaade-kriisiinfoteenuse-%28krit%29-sundmustest-ja-nende-raames-valja-saadetud-ohuteavitussonumitest-ee-alarm-%282025%29,Example value for first MVP plot
